{
  "servico": {
    "situacao_tributaria_pis_cofins": "string",
    "base_calculo_pis_cofins": "string",
    "aliquota_pis": "string",
    "aliquota_cofins": "string",
    "valor_pis": "string",
    "valor_cofins": "string",
    "tipo_retencao_pis_cofins": "string",
    "codigo_indicador_operacao": "string",
    "chaves_nfse_referenciadas": "string",
    "chaves_nfse_referenciadas[]": {
      "chave_nfse": "string"
    },
    "ibs_cbs_situacao_tributaria": "string",
    "ibs_cbs_classificacao_tributaria": "string",
    "codigo_municipio_incidencia": "string",
    "perc_reducao_aliquota_compra_governamental": "string",
    "ibs_cbs_base_calculo": "string",
    "codigo_nbs": "string"
  },
  "percentual_total_tributos_federais": "string",
  "percentual_total_tributos_estaduais": "string",
  "percentual_total_tributos_municipais": "string",
  "percentual_total_tributos_simples_nacional": "string",
  "finalidade_emissao": "string",
  "consumidor_final": "string",
  "tipo_operacao_governamental": "string",
  "tipo_ente_governamental": "string",
  "indicador_destinatario": "string",
  "documentos_referenciados": "string",
  "documentos_referenciados[]": {
    "tipo_chave_dfe": "string",
    "descricao_chave_dfe": "string",
    "chave_dfe": "string",
    "codigo_municipio_documento_fiscal_outro": "string",
    "numero_documento_fiscal_outro": "string",
    "descricao_documento_fiscal_outro": "string",
    "numero_documento_nao_fiscal_outro": "string",
    "descricao_documento_nao_fiscal_outro": "string",
    "cnpj_fornecedor": "string",
    "cpf_fornecedor": "string",
    "nif_fornecedor": "string",
    "motivo_ausencia_nif_fornecedor": "string",
    "razao_social_fornecedor": "string",
    "data_emissao_documento_dedutivel": "string",
    "data_competencia_documento_dedutivel": "string",
    "tipo_valor_incluido": "string",
    "descricao_tipo_valor_incluido": "string",
    "valor_repasse": "string"
  },
  "modo_prestacao": "string",
  "vinculo_negocio": "string",
  "codigo_moeda": "string",
  "valor_servico_ext": "string",
  "mecanismo_comercio_ext_prestador": "string",
  "mecanismo_comercio_ext_tomador": "string",
  "movimentacao_temporaria_bens": "string",
  "numero_declaracao_importacao": "string",
  "numero_registro_exportacao": "string",
  "mdic": "string",
  "evento": {
    "nome": "string",
    "descricao": "string"
  }
}